{
  "schema": "https://policy-atoms.com/schemas/atom-v1.json",
  "type": "policy",
  "id": "ai-agent/no-agent-credential-access",
  "version": "1.0.0",
  "name": "Agents cannot read credential stores directly",
  "description": "AI agents are denied direct read access to credential stores, secret vaults, .env files, keychain entries, and any resource that resolves to a plaintext secret. Agents must request credentials via an intermediary that returns presence confirmation, not values.",
  "tags": ["ai-agent", "secrets", "credential-access", "safety"],
  "policy": {
    "effect": "deny",
    "subjects": ["agent:*", "identity:ai-*"],
    "resources": ["credential-store:*", "vault:*", "keychain:*", "file:.env*"],
    "actions": ["read"],
    "conditions": [],
    "rationale": "An agent that can read credentials can exfiltrate them — either intentionally through prompt injection or accidentally by including them in a response. Intermediary-only access prevents this class of leak."
  }
}
