{
  "schema": "https://policy-atoms.com/schemas/atom-v1.json",
  "type": "policy",
  "id": "safety/no-secrets-in-artifacts",
  "version": "1.0.0",
  "name": "CI artifacts must not contain secrets or credentials",
  "description": "Build artifacts, container images, and published packages must pass secret-scanning checks. Artifacts containing API keys, tokens, passwords, or private keys are denied publication.",
  "tags": ["secrets", "safety", "ci-gate", "supply-chain"],
  "policy": {
    "effect": "deny",
    "subjects": ["*"],
    "resources": ["artifact:*", "container-image:*", "package:*"],
    "actions": ["publish", "upload", "push"],
    "conditions": [
      {
        "type": "if",
        "check": "scan:secret-detected"
      }
    ],
    "rationale": "Secrets embedded in artifacts leak to every consumer of that artifact. Rotation after a public leak is painful and often incomplete."
  }
}
