{
  "schema": "https://policy-atoms.com/schemas/atom-v1.json",
  "type": "policy",
  "id": "access-control/no-shared-credentials",
  "version": "1.0.0",
  "name": "Credentials must not be shared between principals",
  "description": "Service accounts, API keys, and user credentials must be bound to exactly one principal. Credentials detected as in use by more than one distinct identity are denied and flagged for rotation.",
  "tags": ["access-control", "credentials", "identity", "audit"],
  "policy": {
    "effect": "deny",
    "subjects": ["*"],
    "resources": ["credential:*", "api-key:*", "service-account:*"],
    "actions": ["use", "authenticate"],
    "conditions": [
      {
        "type": "if",
        "check": "credential:shared-by-multiple-principals"
      }
    ],
    "rationale": "Shared credentials prevent attribution — when an incident occurs, you cannot determine which principal acted. They also mean revoking one compromised user requires rotating credentials that other users depend on."
  }
}
