{
  "schema": "https://policy-atoms.com/schemas/atom-v1.json",
  "type": "policy",
  "id": "safety/no-direct-production-deploy",
  "version": "1.0.0",
  "name": "No direct production deployment without CI green gate",
  "description": "Production deployments require all CI checks to pass before the deploy action is permitted. Manual out-of-band deploys that bypass CI are denied.",
  "tags": ["deployment", "safety", "ci-gate", "production"],
  "policy": {
    "effect": "deny",
    "subjects": ["*"],
    "resources": ["environment:production:*"],
    "actions": ["deploy"],
    "conditions": [
      {
        "type": "unless",
        "check": "ci:all-checks-green"
      }
    ],
    "rationale": "CI is the only systematic verification that code is correct before it reaches production. Bypassing it trades a transient inconvenience for an unquantified blast radius."
  }
}
